{
  "body": "Source: repo-bloat review (rev-tests finding 1 & 2, issue #1043). `packages/tickets/test/directory.test.mjs`, `packages/tickets/test/manifest-rails.test.mjs`, `packages/tickets/test/pointer-bounded.test.mjs`, and `packages/tickets/test/pointer.test.mjs` manually invoke `mkdtempSync` and guard removals in 25 `try/finally` blocks (plus several fixture leaks in pointer-bounded and pointer tests), and are allowlisted in `scripts/test/tmp-fixture-boundary.test.mjs`. With `@adlc/core/test-kit` (`tmp`), fixture directories automatically register cleanup via `t.after` when passed the test context `t`.\n\nNORMATIVE BEHAVIOUR.\n1. In `packages/tickets/test/directory.test.mjs`:\n   - Import `{ tmp }` from `@adlc/core/test-kit`.\n   - Update test declarations using temp directories to accept the `t` parameter from `test(...)`.\n   - Replace `const root = () => mkdtempSync(join(tmpdir(), 'adlc-tickets-directory-'))` with `tmp(t, 'adlc-tickets-directory-')`.\n   - Remove manual `try { ... } finally { rmSync(dir, ...); }` blocks, unindenting the test bodies.\n2. In `packages/tickets/test/manifest-rails.test.mjs`:\n   - Import `{ tmp }` from `@adlc/core/test-kit`.\n   - Update test declarations using temp directories to accept the `t` parameter.\n   - Replace `mkdtempSync(join(tmpdir(), ...))` with `tmp(t, ...)`.\n   - Remove manual `try { ... } finally { rmSync(root, ...); }` blocks, unindenting the test bodies.\n3. In `packages/tickets/test/pointer-bounded.test.mjs`:\n   - Import `{ tmp }` from `@adlc/core/test-kit`.\n   - Update test declarations to accept `t` parameter.\n   - Replace uncleaned `mkdtempSync(join(tmpdir(), ...))` calls with `tmp(t, ...)`.\n4. In `packages/tickets/test/pointer.test.mjs`:\n   - Import `{ tmp }` from `@adlc/core/test-kit`.\n   - Update `fixture(t, prefix = 'adlc-pointer-')` to accept `t` and create `root` via `tmp(t, prefix)`. Remove the `cleanup` callback property from the returned object.\n   - Update test cases calling `fixture` to accept `t` parameter and pass `t` to `fixture(t, ...)`.\n   - Remove all 17 `try { ... } finally { f.cleanup(); }` blocks, unindenting the test bodies.\n   - Replace leaking `root = mkdtempSync(join(tmpdir(), 'adlc-pointer-uninit-'))` with `tmp(t, 'adlc-pointer-uninit-')`.\n5. In `scripts/test/tmp-fixture-boundary.test.mjs`:\n   - Remove `'packages/tickets/test/directory.test.mjs'`, `'packages/tickets/test/manifest-rails.test.mjs'`, `'packages/tickets/test/pointer-bounded.test.mjs'`, and `'packages/tickets/test/pointer.test.mjs'` from the `ALLOWLIST` set. (This removes the last remaining files from packages/tickets in ALLOWLIST).\n6. Verification:\n   - `npm test -w packages/tickets` exits 0 with all 379 tests passing.\n   - `node --test scripts/test/tmp-fixture-boundary.test.mjs` exits 0.\n   - `grep -c 'finally' packages/tickets/test/directory.test.mjs packages/tickets/test/manifest-rails.test.mjs packages/tickets/test/pointer.test.mjs` outputs 0, 0, 0.\n\nACCEPTANCE CRITERIA.\n- AC1 `grep -c 'finally' packages/tickets/test/directory.test.mjs packages/tickets/test/manifest-rails.test.mjs packages/tickets/test/pointer.test.mjs` reports 0, 0, 0.\n- AC2 `grep -c 'f.cleanup()' packages/tickets/test/pointer.test.mjs` reports 0.\n- AC3 `grep -E 'packages/tickets/test/' scripts/test/tmp-fixture-boundary.test.mjs` returns nothing.\n- AC4 `npm test -w packages/tickets` exits 0 with all tests passing.\n- AC5 `node --test scripts/test/tmp-fixture-boundary.test.mjs` exits 0.\n- AC6 `adlc rails-guard` exits 0.",
  "category": "refactor",
  "completed": true,
  "duration": 2,
  "edges": [],
  "id": "T-01M35GNS78RVQ2NBSTMSMPT9PN",
  "rails": [],
  "scope": [
    "packages/tickets/test/directory.test.mjs",
    "packages/tickets/test/manifest-rails.test.mjs",
    "packages/tickets/test/pointer-bounded.test.mjs",
    "packages/tickets/test/pointer.test.mjs",
    "scripts/test/tmp-fixture-boundary.test.mjs"
  ],
  "title": "refactor(tickets): adopt @adlc/core/test-kit and eliminate 25 try/finally blocks and fixture leaks across tickets tests"
}
