{
  "body": "Follow-on to T48. T48 shipped a prose-instructed P5 fan-out for Codex: plugins/adlc-codex/skills/adlc-prosecute/SKILL.md instructs the operating agent to manually loop through the five lens agents, dedupe, verify, and repeat. plugins/adlc-codex/lib/prosecutor.mjs re-exports @adlc/core's dedupeFindings/survivesVerification/shouldContinue, but nothing at Codex runtime actually CALLS these functions — they exist for reference-equality testing and documentation only.\n\nplugins/adlc-opencode/lib/prosecute-runner.mjs (T33) is a strictly more rigorous pattern already shipped for OpenCode: runProsecution() is real, unit-tested driver code that actually invokes dedupeFindings/survivesVerification/shouldContinue, fanning out lens/verifier calls through OpenCode's session.create/session.prompt child-session API with a write-disabled tools permission map (wildcard-deny-first allowlist), bounded by maxRounds/maxSessions/maxDry. It is wired to a native `adlc_prosecute`-style tool inside the OpenCode plugin process itself.\n\nCodex's own MCP tool named `adlc_prosecute` (packages/cli/lib/mcp-server.mjs) is NOT equivalent — it only wraps `adlc prosecute --input ... --ticket ...`, i.e. recording already-decided P5 evidence from a file. It has no fan-out/dedupe/verify/loop logic at all. This ticket determines whether Codex's plugin/MCP architecture can support an OpenCode-style deterministic driver, and if so, builds it; if not, it documents why and proposes the best available alternative.\n\n=== CONTRACT (write then gate) ===\nAuthor .adlc/specs/codex-deterministic-prosecution.md as the binding P1 spec before coding. It must answer, with evidence (not assumption): does Codex's plugin architecture (skills, hooks, MCP server, project agents/*.toml) expose ANY mechanism for a running process to spawn an isolated child agent session and receive its reply programmatically — the capability OpenCode's runProsecution() depends on via client.session.create/session.prompt? Sources to check: Codex's own plugin/agent documentation, whether the MCP protocol itself supports server-initiated sampling (MCP's `sampling/createMessage` request type lets an MCP SERVER ask the CLIENT/host to run a model completion — this may be the closest real primitive, if Codex's MCP client implementation supports it). Do not assume feasibility either way — verify against real documentation or a working spike, the same way T52's spec corrected a wrong assumption about Claude Code's hook vocabulary by checking the live docs first.\n\nIf a viable mechanism exists: the spec designs a plugins/adlc-codex/lib/prosecute-runner.mjs mirroring plugins/adlc-opencode/lib/prosecute-runner.mjs's shape (an injectable `ask()` driver, real code calling the @adlc/core helpers, bounded rounds/sessions/dry-streak), wired into the MCP server as a new tool (or an extended `adlc_prosecute` mode) that a Codex session invokes to run the whole loop in one call.\n\nIf no viable mechanism exists: the spec documents the finding plainly and proposes the best available fallback — for example, strengthening the existing prose-instructed loop in SKILL.md with stricter machine-checkable self-verification (e.g. requiring the operating agent to paste each round's raw findings JSON into an `adlc prosecute-lint`-style deterministic dedupe/verify checker before proceeding), so at least the dedupe/verify/loop MATH is deterministic even if the individual lens calls remain prose-instructed. This ticket does not ship a broken or aspirational MCP tool either way — the deliverable matches whatever the spec's feasibility finding supports.\n\n=== DELIVERABLES (feasible path) ===\n1. plugins/adlc-codex/lib/prosecute-runner.mjs — a deterministic driver mirroring plugins/adlc-opencode/lib/prosecute-runner.mjs's runProsecution() shape, using the real @adlc/core helpers via plugins/adlc-codex/lib/prosecutor.mjs.\n2. MCP wiring in packages/cli/lib/mcp-server.mjs (or a Codex-specific server extension) exposing the driver as a callable tool.\n3. Tests mirroring plugins/adlc-opencode/lib/test coverage for prosecute-runner.mjs (mock `ask()`, bounds, fail-closed unparseable-reply handling).\n4. plugins/adlc-codex/skills/adlc-prosecute/SKILL.md updated to prefer the deterministic tool when available, keeping the T48 prose loop documented as the fallback for hosts/sessions where the tool cannot run.\n\n=== DELIVERABLES (infeasible path) ===\n1. .adlc/specs/codex-deterministic-prosecution.md documents the platform limitation with citations.\n2. The strengthened prose-loop fallback (or an equivalent honest improvement) is designed and, if in scope after review, implemented.\n3. No aspirational claims are added to SKILL.md, docs, or integration-facts.mjs about automatic/deterministic execution that the platform cannot actually provide.\n\n=== ACCEPTANCE CRITERIA ===\n- AC1: The spec states a definitive, evidence-backed answer (yes/no) to the child-session/sampling feasibility question, with sources cited. VERIFY: manual review of .adlc/specs/codex-deterministic-prosecution.md for citations, not assertions.\n- AC2 (feasible path only): plugins/adlc-codex/lib/prosecute-runner.mjs exists and its tests pass, mirroring OpenCode's coverage shape. VERIFY: node --test plugins/adlc-codex/lib/test/prosecute-runner.test.mjs (new).\n- AC3 (feasible path only): the MCP tool surface change is reflected in docs/integrations/codex.md, apps/docs/content/docs/integrations/codex.mdx, and apps/docs/lib/integration-facts.mjs's mcp count/items, with apps/docs/test/codex-docs-current.test.mjs passing.\n- AC4: `adlc rails-guard --base main --ticket T53` passes; `npm test` passes at the root.\n- AC5: Nothing in the shipped documentation overstates what was actually built — if the infeasible path was taken, docs/SKILL.md continue to describe the T48 prose loop honestly rather than implying automatic execution.\n\n=== OUT OF SCOPE ===\n- Changing OpenCode's prosecute-runner.mjs (source pattern; port from it, do not modify it).\n- T48 (already shipped and is not being reverted by this ticket), T49/T50/T51/T52 (separate tickets).",
  "budget": "frontier",
  "category": "feature",
  "completed": true,
  "duration": 5,
  "edges": [],
  "id": "T53",
  "rails": [
    "plugins/adlc-opencode/**",
    "packages/core/lib/prosecutor.mjs"
  ],
  "scope": [
    "plugins/adlc-codex/lib/**",
    "plugins/adlc-codex/skills/adlc-prosecute/**",
    "packages/cli/lib/mcp-server.mjs",
    "packages/cli/test/**",
    "docs/integrations/codex.md",
    "apps/docs/content/docs/integrations/codex.mdx",
    "apps/docs/lib/integration-facts.mjs",
    "apps/docs/test/codex-docs-current.test.mjs",
    ".adlc/specs/codex-deterministic-prosecution.md"
  ],
  "title": "Investigate and, if feasible, port OpenCode's deterministic P5 prosecution driver (T33) to Codex"
}
