{
  "body": "ADLC P7 (distill) for the #284 / #309 session.\n\n## Problem\n\nCONTRIBUTING step 2 told contributors to run `npm test` before pushing. CI\nblocks a PR on THREE required gates:\n\n  npm test                                  (suite)\n  node scripts/rails-guard-ci.mjs origin/main   (rail-freeze + trust root)\n  node scripts/mutation-gate.mjs origin/main    (mutation coverage)\n\nTwo of the three were documented nowhere and had no local entry point, so doing\nexactly what CONTRIBUTING said still left a contributor surprised by CI.\n\nWorse, there is an active trap: `adlc rails-guard` and\n`scripts/rails-guard-ci.mjs` sound interchangeable and are not. The CI script\nadditionally forbids any change to an EXISTING ticket's contract in\n.adlc/tickets.json (the rail trust root). The weaker check is the more\ndiscoverable one.\n\nThis is not hypothetical. In the #309 session a branch reused a ticket id that a\nconcurrent session had already claimed on main, silently rewriting that ticket's\ncontract. `adlc rails-guard` reported \"all checks passed\" throughout; CI\nrejected the PR. The gate did its job — the local workflow was the defect.\n\n## Deterministic defense (preferred over prose)\n\n1. `scripts/preflight.mjs` + `npm run preflight` — runs all three PR-blocking\n   gates in CI's order, cheapest first, stopping at the first failure, after\n   fetching the base ref (a stale origin/<base> makes both diff gates compare\n   against the wrong tree and pass for the wrong reason).\n2. CONTRIBUTING step 2 points at preflight and names the three gates.\n3. `adlc rails-guard`'s clean-pass output carries a stderr advisory naming the\n   stricter CI gate, so the friendlier command stops reading as full clearance.\n   STDERR and human-mode only — stdout and the --json contract are untouched.\n\n## Prose defense (only for what a script cannot encode)\n\n`AGENTS.md` at the repo root — harness-agnostic, because this repo ships seven\nharness plugins and a Claude-specific file would contradict that. Limited to\nnon-derivable, session-proven lessons: preflight vs npm test; ticket ids must be\nre-read after a fetch AND checked against open PRs; never `git checkout --` a\nfile to undo a mutation experiment (it discards uncommitted work); check for a\nconcurrent agent session mutating the checkout; PRs are squash-merged so a\nstacked base needs cherry-pick, not rebase.\n\n## Acceptance criteria\n\n1. `npm run preflight` exists and runs exactly the gates CI blocks on. Verify by\n   a test that reads .github/workflows/ci.yml and asserts each CI gate marker\n   has a corresponding command in preflight — so CI growing a gate reds the\n   test rather than silently outdating the script.\n2. preflight fetches the base ref before the diff-based gates, and fails\n   (non-zero, with a clear message) when the base cannot be resolved rather than\n   comparing against nothing. Verify by driving the real script with an\n   unresolvable --base.\n3. preflight stops at the first failing gate and exits non-zero.\n4. A clean `adlc rails-guard` run emits a stderr advisory naming\n   scripts/rails-guard-ci.mjs, the .adlc/tickets.json rule that differs, and\n   `npm run preflight`. Verify by driving the real bin.\n5. The advisory does NOT appear on stdout and does NOT appear in --json mode;\n   `--json` output still parses. Verify by driving the real bin both ways.\n6. CONTRIBUTING names `npm run preflight`.\n7. `npm test` green; `npm run preflight` green.\n\n## Constraints\n\n- rails-guard is an ENFORCEMENT package (trust-root tier): the change there must\n  be output-only, with no effect on exit codes, violation detection, the --json\n  document, or the manifest record. Per ADLC P5 this tier also requires a\n  cross-model review recorded before merge — flag it rather than self-approving.\n- Do not restate in AGENTS.md what CONVENTIONS.md or the code already encode.",
  "category": "chore",
  "completed": true,
  "duration": 1,
  "edges": [],
  "id": "T71",
  "rails": [],
  "scope": [
    "scripts/preflight.mjs",
    "scripts/test/**",
    "packages/rails-guard/bin/**",
    "packages/rails-guard/test/**",
    "AGENTS.md",
    "CONTRIBUTING.md",
    "package.json"
  ],
  "title": "Make the local gate set match CI, and record the working lessons agents cannot derive"
}
